id,name,host_id,host_name,neighbourhood_group,neighbourhood,latitude,longitude,room_type,price,minimum_nights,number_of_reviews,last_review,reviews_per_month,calculated_host_listings_count,availability_365
18121509,Westside Santa Cruz Dream,40913202,Lisa,,City of Santa Cruz,36.97301,-122.03909,Entire home/apt,350,2,5,2017-09-04,0.13,1,0
18158062,Sunny Westside Santa Cruz Home,124851476,Sheena,,City of Santa Cruz,36.96359,-122.03888,Entire home/apt,200,3,2,2017-08-18,0.06,1,0
18159886,"Garden Oasis Guesthouse Relax, Surf & Adventure",125247297,Terry,,Unincorporated Areas,36.97201,-121.9802,Entire home/apt,99,1,167,2020-06-24,4.30,1,36
18273220,Pelican Point 60,29898175,Brandelia,,Unincorporated Areas,36.85849,-121.81393,Entire home/apt,328,2,4,2020-02-16,0.17,35,321
18285889,"Westcliff Cottage - Quiet Paradise, by the Beach",64453003,Carl,,City of Santa Cruz,36.95357,-122.04495,Entire home/apt,175,3,2,2019-08-18,0.19,1,0
18295945,Bedroom with View - Steps From Beach Boardwalk,126536961,Rick,,City of Santa Cruz,36.9658,-122.02269,Private room,109,2,63,2020-04-26,1.66,2,139
18311460,Capitola Venetian Beach Front- 12 Steps to Sand!,16995492,Leonard,,City of Capitola,36.97198,-121.95382,Entire home/apt,795,3,29,2020-06-21,0.92,1,333
18356498,Creekside Cottage,11045985,Lucille,,City of Santa Cruz,36.97416,-122.03856,Entire home/apt,150,2,61,2020-06-28,1.63,1,0
18374004,Ocean View Studio Condo at Seascape Resort!,119944386,Nanette,,Unincorporated Areas,36.95146,-121.87713,Entire home/apt,185,2,52,2020-03-08,1.43,1,40
18413736,Charming Capitola Beach House,1138417,Michele,,City of Capitola,36.97414,-121.95102,Entire home/apt,250,30,0,,,1,117
18425584,Amazing Views - Steps from Beach Boardwalk,126536961,Rick,,City of Santa Cruz,36.96628,-122.02222,Entire home/apt,649,2,36,2020-06-21,0.96,2,141
18451223,Beach Front Villa at Seascape Resort,26381913,Ken,,Unincorporated Areas,36.95125,-121.87722,Entire home/apt,350,1,74,2020-06-24,2.13,1,321
18489207,Secret Garden Eco Retreat w/Hot Tub - Ruby Room,103700953,Scott Maya,,City of Capitola,36.97986,-121.97332,Private room,65,2,151,2019-11-10,4.03,2,0
18549276,"Mama's House ""The Bunny & Badger""",69289902,Mj,,Unincorporated Areas,36.97283,-121.8935,Private room,110,2,84,2019-09-29,2.23,1,148
18550381,Pleasure Point Surf & Sand,41523119,Kevin And Barbara,,City of Capitola,36.95714,-121.97523,Private room,85,2,168,2020-03-18,4.42,1,264
18565610,"West Side Santa Cruz Studio, two blocks from ocean",128879175,Laura,,City of Santa Cruz,36.95237,-122.04654,Entire home/apt,210,2,43,2019-08-16,1.13,1,0
18610607,"The ""Sea Pearl"" at Seabright Beach in Santa Cruz",50311315,Joanna,,City of Santa Cruz,36.96609,-122.01005,Entire home/apt,395,3,70,2020-02-24,1.88,1,323
18617853,Ben Lomond Retreat At It's Best!,79363101,Wendy,,Unincorporated Areas,37.0686,-122.08136,Entire home/apt,275,2,6,2017-09-10,0.17,1,0
18686261,The little village on the West side,56883525,Kelley And Michael,,City of Santa Cruz,36.96842,-122.04026,Entire home/apt,350,2,92,2020-03-15,2.46,1,105
18688761,Gorgeous Remodeled Seascape Resort Large 1 Bedroom,24413952,Taylor Property,,Unincorporated Areas,36.94967,-121.87813,Entire home/apt,149,2,87,2020-06-17,2.40,18,255
18689995,"Santa Cruz Harbor, Light and Open Guest Suite",129922515,Michael,,City of Santa Cruz,36.96499,-121.99802,Private room,250,2,47,2020-06-21,1.26,1,163
18705716,La Selva Beach in-law studio | 2 free MBAQ passes,17844996,Jane,,Unincorporated Areas,36.94204,-121.85188,Entire home/apt,145,2,142,2020-03-08,3.75,1,300
18708950,Ocean Suite,9624830,Peter,,Unincorporated Areas,37.01088,-122.19415,Entire home/apt,139,1,64,2020-06-27,1.70,1,70
18716708,Victorian at the Beach,26065508,Debra,,City of Santa Cruz,36.96509,-121.99916,Entire home/apt,775,4,5,2019-07-14,0.20,1,210
18734666,Twin Lakes Hideaway - walk to the beach or harbor,87703596,Darian,,Unincorporated Areas,36.97512,-121.99366,Entire home/apt,225,1,196,2020-06-13,5.21,1,194
18744802,Treetop house overlooking scenic forest valley,130398557,Ralph,,Unincorporated Areas,37.07839,-122.0778,Entire home/apt,321,3,2,2017-12-29,0.06,1,0
18788405,"Bird of Paradise, 1 block from Rio Del Mar Beach",51003705,Bailey Property Management,,Unincorporated Areas,36.96966,-121.90428,Entire home/apt,341,2,7,2020-02-17,0.19,29,0
18789607,Gated Estate House in Santa Cruz With Views of the Boardwalk,1094909,Camille,,City of Santa Cruz,36.97066,-122.01593,Entire home/apt,950,2,29,2020-06-21,0.88,1,145
18840559,26th Ave Beach Home. 1 block to beach.,17226393,Troy,,City of Capitola,36.95707,-121.97916,Entire home/apt,275,2,226,2020-06-29,5.96,1,309
18843576,Room in B&B Steps from Beach / Boardwalk / Wharf,123278862,Adriana,,City of Santa Cruz,36.96741,-122.02204,Private room,220,1,77,2020-06-29,2.05,5,361
18875280,Willow Pond Ranch,22006172,Tom,,Unincorporated Areas,37.02978,-121.95909,Entire home/apt,1450,2,109,2020-02-17,2.97,2,338
18895873,705/On the Water *OCEANFRONT*,62542564,Kendall & Potter Property Mgmt,,Unincorporated Areas,36.92045,-121.85411,Entire home/apt,600,2,2,2017-06-12,0.05,25,275
18896646,Santa Cruz Oasis ~ Hot Tub ~ Centrally Located,8805029,Sally,,Unincorporated Areas,36.98101,-121.98353,Entire home/apt,295,1,124,2020-03-18,3.33,1,235
18911676,Awesome Beach House,487484,Sunny,,Unincorporated Areas,36.96998,-121.99687,Entire home/apt,300,2,35,2020-01-12,1.00,1,52
18932123,6BR/3.5 BA Yacht Harbor Home 2 blocks from Beach,65907995,Allison,,City of Santa Cruz,36.96562,-121.99777,Entire home/apt,707,3,0,,,2,0
18958158,Capitola Venetian Beach House - Beach Front House,132198788,Michael,,City of Capitola,36.97228,-121.954,Entire home/apt,315,4,0,,,1,0
18960617,Ocean Front (Shorebirds 71),29898175,Brandelia,,Unincorporated Areas,36.87153,-121.82091,Entire home/apt,277,2,12,2020-02-17,0.33,35,331
18982102,Beach Studio Villa's,10341402,Jeanell,,Unincorporated Areas,36.97649,-121.92522,Private room,465,1,11,2020-06-21,0.30,4,0
19014749,Cozy 4 BR/2BA Home 2 Blocks from Beach,65907995,Allison,,City of Santa Cruz,36.9647,-121.99747,Entire home/apt,550,7,1,2018-04-09,0.04,2,0
19039952,Nice bedroom in Santa Cruz,131507273,Yihui,,City of Santa Cruz,36.96576,-122.0325,Private room,65,1,0,,,1,0
19048608,New - Dog Friendly Luxury Oceanview Beach Cottage,132955230,Judy,,Unincorporated Areas,36.96196,-121.98608,Entire home/apt,300,3,5,2018-02-22,0.13,1,0
19052174,Nature Retreat in the Mountains,21976557,Hilary,,Unincorporated Areas,37.06312,-121.95742,Entire home/apt,449,2,76,2020-06-19,2.06,1,202
19098530,The Sunny Escape Into The Woods with Gas Fireplace,366768,Cynthia,,Unincorporated Areas,37.11013,-122.11745,Entire home/apt,105,1,160,2020-06-15,4.33,5,349
19118255,Watch Crashing Waves from Deck at A New Chic Coastal Escape,34302347,Crystal,,Unincorporated Areas,36.96833,-121.90315,Entire home/apt,199,2,166,2020-06-29,5.67,2,247
19137910,Private Apartment Close to Pleasure Point Beaches,69688465,Kimberley,,City of Capitola,36.96792,-121.97175,Entire home/apt,130,2,150,2020-03-04,4.14,1,0
19138473,"Mountain ""Tiny"" House Getaway with Creek View",24635273,Katie,,Unincorporated Areas,37.15697,-122.13103,Entire home/apt,100,2,228,2019-10-18,6.44,1,0
19139901,Luxury Country Apartment with Beach Access.,53303,Robert & Adriana,,Unincorporated Areas,36.91888,-121.84371,Entire home/apt,140,2,111,2020-03-14,3.00,1,161
19160600,"At the BEACH, steps to Harbor & Boardwalk.",77408898,Laura Michelle (MIKA),,City of Santa Cruz,36.96601,-122.00402,Entire home/apt,150,2,58,2020-03-08,1.56,1,0
19175516,Lovely guest house,8874531,Sawsan,,Unincorporated Areas,36.96667,-121.98001,Entire home/apt,109,1,24,2020-06-26,0.66,1,349
19180489,Ocean View Home in Capitola,134124849,Cassandra,,City of Capitola,36.97612,-121.95004,Entire home/apt,380,2,2,2017-10-15,0.06,1,0
19181175,"Santa Cruz, Near Beaches, Private, Quiet & Sweet!",134156931,Maria,,Unincorporated Areas,36.97304,-121.98829,Entire home/apt,84,2,161,2020-03-14,4.40,1,49
19195382,Westside Beach House,134278455,Kim,,City of Santa Cruz,36.95461,-122.03657,Entire home/apt,300,4,6,2018-07-30,0.16,1,0
19226347,Comfy Seabright Guest Suite  near Harbor,17814980,Carol,,City of Santa Cruz,36.97257,-122.00608,Entire home/apt,99,2,142,2020-03-10,3.90,1,0
19229082,Beautiful Beach Room,28831901,Nicole,,Unincorporated Areas,36.97129,-121.9051,Private room,90,2,237,2020-06-13,6.41,1,71
19242729,"Seacliff Ocean View House, Recently Remodeled",133792257,Nancy,,Unincorporated Areas,36.97164,-121.9098,Entire home/apt,320,3,58,2020-03-22,1.57,1,26
19246593,Mount Hermon Garden Cottage,12203734,Ron,,Unincorporated Areas,37.051,-122.05673,Entire home/apt,200,1,24,2019-08-11,0.66,1,0
19247748,Quiet sunny room near Beach Boardwalk and Downtown,79131185,Megan,,City of Santa Cruz,36.97513,-122.01597,Private room,45,2,0,,,1,0
19267033,"Ocean view condo w/ deck, balcony & shared pool - walk one block to the beach!",111814568,Vacasa California,,Unincorporated Areas,36.96809,-121.90219,Entire home/apt,341,2,16,2020-02-16,0.45,2,0
19270771,Lovely West Cliff home ideal for your next beach vacation!,111814852,Vacasa California,,City of Santa Cruz,36.95181,-122.04541,Entire home/apt,316,2,28,2019-11-25,0.77,3,352
19270804,Gorgeous Oceanfront Shorebird Condo Pajaro Dunes,24413952,Taylor Property,,Unincorporated Areas,36.8733,-121.82078,Entire home/apt,249,2,53,2020-03-22,1.51,18,16
19274130,"Serene Relaxing Home - 4mi. to Beach, 1.5 mi. to Golf",127420250,Amy,,Unincorporated Areas,37.00342,-122.02008,Entire home/apt,525,30,62,2020-02-09,1.70,1,194
19319481,Bedroom with full bed in quiet neighborhood,68252876,Steve,,City of Scotts Valley,37.04543,-122.02031,Private room,60,1,105,2019-07-07,2.85,3,0
19333178,Ocean front-On the sand - 715 Sand Dollar Beach,11458270,Cynthia,,Unincorporated Areas,36.92012,-121.85441,Entire home/apt,450,3,8,2020-01-03,0.25,1,194
19346857,"Bright Space, Enclosed by Nature",7730199,Brian & Linnea,,Unincorporated Areas,37.06746,-122.08158,Entire home/apt,150,2,95,2019-11-17,2.63,2,0
19357091,Deer Run Sanctuary in the Redwoods,135658243,Paul,,Unincorporated Areas,37.04165,-122.07671,Entire home/apt,350,2,4,2018-01-01,0.11,3,0
19413289,Schwann Lake Bungalow,136100493,Jewlia,,City of Santa Cruz,36.96633,-121.99662,Entire home/apt,295,4,43,2020-03-11,1.18,1,333
19436850,Great getaway house in amazing location,2549800,Gabriel,,City of Santa Cruz,36.95506,-122.031,Entire home/apt,240,2,20,2019-11-29,0.54,1,0
19437476,Quiet Healing Suite in Santa Cruz,62178862,Mary,,Unincorporated Areas,36.97523,-121.99344,Private room,99,3,11,2019-10-27,0.31,3,224
19441072,Scotts Valley Townhouse,22955359,Lisa,,City of Scotts Valley,37.03911,-122.02958,Entire home/apt,200,3,0,,,1,0
19442745,Spacious bedroom in house in quiet neighborhood,68252876,Steve,,City of Scotts Valley,37.04498,-122.01992,Private room,65,1,180,2020-06-28,4.90,3,86
19491014,2BR w/ Ocean Views - Steps to Beach,81989652,TurnKey Vacation Rentals,,Unincorporated Areas,36.92121,-121.85486,Entire home/apt,306,2,47,2020-01-24,1.30,1,289
19509329,Beautiful Beach House - Short Walk to the Beach!,100114471,Janiece,,Unincorporated Areas,36.96874,-121.90009,Entire home/apt,375,1,77,2020-03-17,2.24,15,279
19546880,Castle Beach Cottage-Walk to the Beach & Boardwalk,137301412,Tina & Rod,,City of Santa Cruz,36.96561,-122.00842,Entire home/apt,295,1,78,2020-06-25,2.18,1,135
19590560,Cottage under the Oaks,137708320,Jim And Sue,,Unincorporated Areas,36.97182,-121.99201,Entire home/apt,125,2,25,2020-06-21,0.70,1,0
19593702,Captain Ron's,137742901,Michelle,,Unincorporated Areas,36.96961,-121.89937,Entire home/apt,380,2,44,2019-09-15,1.21,1,17
19609503,Seabright Sanctuary in the heart of Santa Cruz,37631023,Zayneb,,City of Santa Cruz,36.97641,-122.00814,Entire home/apt,200,1,84,2020-03-02,2.32,1,193
19627278,Serenity at Natural Bridges  - 5 min Walk to Beach,118544251,Elaine,,City of Santa Cruz,36.95327,-122.05415,Entire home/apt,550,1,78,2020-02-18,2.22,2,320
19638537,Beautiful House on the River Walk to Beach,129783160,Victoria,,City of Capitola,36.97646,-121.95506,Entire home/apt,166,60,3,2019-02-02,0.12,1,271
19656627,Country French Beach House,89438686,Judi,,Unincorporated Areas,36.97259,-121.90027,Entire home/apt,241,3,23,2020-05-25,0.96,1,335
19675365,Seascape Escape! Now Featuring Private Hot Tub/Spa,138552865,Himani,,Unincorporated Areas,36.96005,-121.88771,Entire home/apt,172,2,85,2020-03-08,2.47,1,20
19696036,Downtown Condo with a View,105506580,Cordelia,,City of Santa Cruz,36.97382,-122.02023,Entire home/apt,125,5,2,2017-08-14,0.06,2,0
19700764,Cozy Mountain Retreat,86799861,George And Susie,,Unincorporated Areas,37.0606,-121.94412,Entire home/apt,90,1,150,2020-03-16,4.14,1,0
19702556,Large room in a home in park-like setting,126041032,Kim,,Unincorporated Areas,36.99273,-121.91292,Private room,95,1,120,2020-03-18,3.37,1,11
19703175,Visit Manresa Beach from a Tranquil Home,45166863,Gail,,Unincorporated Areas,36.92861,-121.85644,Entire home/apt,248,3,117,2020-03-30,3.27,1,308
19746839,Seabright Beach Garden Cottage,90296012,Anne,,City of Santa Cruz,36.97438,-122.01095,Entire home/apt,100,28,124,2020-03-09,3.47,1,0
19789445,Cozy Santa Cruz Cottage - Walk to Beach & Pier!,126644161,Evolve Vacation Rental,,City of Santa Cruz,36.96621,-122.02266,Entire home/apt,259,3,6,2020-02-17,0.20,2,326
19804404,Oak Ridge Hilltop Cabin,139881053,David,,Unincorporated Areas,37.00963,-121.92131,Entire home/apt,150,1,2,2017-10-04,0.06,1,0
19825214,Sunny Day Valley Aptos Private Oasis,15937220,Jeff And Adele,,Unincorporated Areas,36.99554,-121.86543,Private room,47,1,2,2017-09-17,0.06,1,0
19825642,Queenie's at the Beach with Panoramic Ocean Views,36177222,Jeanne,,Unincorporated Areas,36.96973,-121.90575,Entire home/apt,230,3,35,2020-06-28,0.99,1,343
19828186,Nice cosy quiet room w/ King - well located,60643540,Rajarshi,,City of Santa Cruz,36.97686,-122.05473,Private room,65,1,38,2017-10-08,1.05,1,0
19831461,"Yurt at Eco-Retreat Center, Shelter-in-Paradise",109505884,Raine & Emberlie,,Unincorporated Areas,37.02736,-121.88109,Private room,70,2,67,2020-03-10,1.91,6,4
19842992,"Santa Cruz area serene retreat, sleeps 8",3432555,Geralynn,,Unincorporated Areas,37.05031,-122.0498,Entire home/apt,250,2,127,2020-06-20,3.57,1,282
19848447,Cute Santa Cruz Harbor area Cottage with Hot Tub,21880927,Karl,,City of Santa Cruz,36.96764,-121.99926,Entire home/apt,225,1,52,2020-04-08,1.45,1,0
19856820,La Selva Beach Sanctuary,26300057,Claudia,,Unincorporated Areas,36.93595,-121.86443,Private room,145,1,91,2020-06-28,2.60,1,57
19863843,Safari in the Heart of the Redwoods,36830606,Cyndi,,Unincorporated Areas,37.15873,-122.16538,Private room,100,1,124,2020-02-16,3.51,1,333
19910287,A Gathering Place in the Countryside,1971090,Kimberly,,Unincorporated Areas,37.056,-121.94884,Entire home/apt,750,3,9,2019-07-05,0.29,1,146
19914752,Country Garden Private Guest Suite (Dog friendly),33317689,Anastasia,,Unincorporated Areas,37.01358,-122.03,Private room,75,1,205,2020-06-28,5.86,1,160
19950709,Private 1 bedroom near Capitola Beach,77947232,Sabrina,,Unincorporated Areas,36.98664,-121.94444,Private room,90,1,7,2019-10-27,0.66,1,0
19981914,Hammock haven,9484020,Kendra,,Unincorporated Areas,36.9785,-121.91783,Entire home/apt,450,2,0,,,1,0
19982366,"Abundance Home, Santa Cruz, Nest in the Redwoods",8012361,Stephen - Will,,Unincorporated Areas,37.06848,-122.13268,Private room,105,1,9,2018-07-22,0.25,5,0
19987478,"Adobe Casita at Eco-Retreat, Shelter-in-Paradise",109505884,Raine & Emberlie,,Unincorporated Areas,37.02719,-121.88173,Private room,75,2,46,2020-04-10,1.32,6,4
20005270,Ocean Front Bungalow Santa Cruz Ca,141987089,Ann,,City of Capitola,36.95622,-121.97091,Entire home/apt,500,2,16,2020-02-17,0.50,1,246
20030916,Santa Cruz Guest Studio,30867475,Stephanie,,City of Santa Cruz,36.96566,-121.99613,Entire home/apt,95,30,15,2018-12-26,0.55,1,0
20034167,Deer Run Sanctuary- 2 Bedroom,135658243,Paul,,Unincorporated Areas,37.04063,-122.07766,Entire home/apt,200,2,11,2018-06-30,0.33,3,0
20045630,Santa Cruz Guesthouse Surrounded by a Redwood Forest,47316700,Kris & Shane,,Unincorporated Areas,37.00583,-122.00297,Entire home/apt,157,2,227,2020-06-27,6.45,7,96
20089803,Amazing house on the Beach!!!..ON SITE MAIDS,142837465,Katie,,Unincorporated Areas,36.86689,-121.81739,Entire home/apt,1100,3,1,2019-10-06,0.11,1,311
20094903,Kinderwood Farms Suite,62157421,Lauren,,Unincorporated Areas,36.98705,-121.89791,Entire home/apt,200,1,256,2020-03-12,7.34,2,78
20095110,Pleasure Point Beach Cottage,142909540,Eric,,City of Capitola,36.96028,-121.97111,Entire home/apt,325,2,97,2020-06-26,2.92,1,287
20119433,Deer Run in the Redwoods - Studio,135658243,Paul,,Unincorporated Areas,37.04022,-122.07807,Entire home/apt,125,2,1,2017-08-11,0.03,3,0
20152874,Small trek to Capitola village and beach.,141752377,Alexanda,,Unincorporated Areas,36.98576,-121.95359,Private room,89,1,45,2018-06-16,1.27,1,0
20169174,Social distancing in hippy VW Westy in Redwoods,27439127,Connie,,City of Santa Cruz,36.97505,-122.03072,Entire home/apt,120,1,71,2020-06-25,2.04,2,84
20169898,Private Master Suite + 2 Free MB Aquarium passes,7078579,Cayley,,Unincorporated Areas,36.96658,-121.87299,Private room,85,1,163,2020-03-09,4.64,2,0
20195229,Tranquil Private Casita!,854712,Vacation,,Unincorporated Areas,37.05084,-121.92889,Entire home/apt,125,31,2,2020-03-01,0.10,8,333
20217251,2BR Aptos Cottage w/Deck & Views - 10 Min to Beach,126644161,Evolve Vacation Rental,,Unincorporated Areas,36.96955,-121.88008,Entire home/apt,398,2,7,2019-12-31,0.30,2,266
20223335,"Two bedroom cottage just blocks from the beach in Pleasure Point, Santa Cruz!",143960566,Bill,,City of Capitola,36.95839,-121.97216,Entire home/apt,258,2,33,2019-11-11,0.98,3,0
20223842,This one bedroom unit is located just blocks from Pleasure Point!,143960566,Bill,,City of Capitola,36.95629,-121.97221,Entire home/apt,258,2,25,2020-03-16,0.76,3,254
20235310,Snug and Cozy between the Skyline and the Sea,143203896,Judith,,City of Scotts Valley,37.04024,-122.04224,Private room,59,1,327,2020-06-26,9.38,1,124
20235429,Ringtail Ranch - 3 rooms,1584134,Pascal,,Unincorporated Areas,37.05618,-122.11085,Private room,120,1,73,2019-11-29,2.15,4,172
20270106,Santa Cruz Westside Bungalow,144515334,Loretta,,City of Santa Cruz,36.95464,-122.0366,Entire home/apt,189,3,14,2018-05-28,0.40,1,0
20271021,Private Home at foot of Santa Cruz Mountains,144525879,Ryan,,City of Scotts Valley,37.06201,-121.99953,Entire home/apt,359,4,10,2019-08-04,0.33,1,29
20282695,Bright and Cheery Santa Cruz studio...,8115361,Bright & Cheery Living,,City of Santa Cruz,36.98442,-122.0232,Entire home/apt,100,2,181,2020-06-14,5.26,1,36
20307783,Welcome to Harbor House... Your Favorite Home at the Beach.,110863622,Aaron,,City of Santa Cruz,36.96812,-122.00819,Entire home/apt,245,3,89,2020-06-18,2.63,1,287
20309326,No-frills den sleeps up to 6 in quiet neighborhood,68252876,Steve,,City of Scotts Valley,37.04558,-122.01952,Shared room,0,1,16,2018-11-16,0.45,3,0
20501209,Half Our Home is Yours- Enjoy Beaches & Redwoods!,146359429,Judy And Brian,,Unincorporated Areas,37.08145,-122.07694,Private room,130,1,35,2020-02-01,1.05,3,227
20502622,Walk to the Beach Boardwalk & Downtown Santa Cruz,854712,Vacation,,City of Santa Cruz,36.9669,-122.02121,Entire home/apt,165,31,4,2020-01-14,0.13,8,289
20521215,"""Welcome Inn"" beach house (H129)",29898175,Brandelia,,Unincorporated Areas,36.86739,-121.81831,Entire home/apt,528,2,10,2019-06-24,0.29,35,335
20539707,"Ocean-View Paradise w/ Hot Tub, 1 Block to Beach",143524740,TurnKey Vacation Rentals,,City of Santa Cruz,36.95367,-122.02649,Entire home/apt,459,2,7,2020-03-08,0.22,1,24
20544898,Spectacular Tiny Home in a Hidden Oasis of Nature & Serenity,105054999,Amnon,,Unincorporated Areas,37.16881,-122.15577,Entire home/apt,195,1,171,2020-06-23,5.00,3,118
20554368,Elegant Small Farm Getaway in the Mountains,20210962,April,,Unincorporated Areas,37.06995,-121.96502,Entire home/apt,110,2,22,2019-06-10,0.64,2,296
20572586,"Half mile to downtown
One mile to the beach",46324399,Tom,,City of Santa Cruz,36.96714,-122.03591,Entire home/apt,395,2,61,2020-06-14,2.53,1,32
20714339,Seabright Beach house,148310301,Andrew,,City of Santa Cruz,36.96662,-122.00831,Entire home/apt,379,2,55,2020-02-20,1.63,2,160
20728790,Capitola Dream Condo - Monthly Rental,148440132,Caryn,,City of Capitola,36.97145,-121.96243,Entire home/apt,86,30,0,,,1,272
20746507,Cozy & Sunny 2-bedroom cottage in Seabright,76446048,Susan,,City of Santa Cruz,36.97712,-122.01161,Entire home/apt,130,1,323,2020-06-27,9.50,1,275
20771245,Loggerâ€™s Cabin in the Majestic Redwoods!,121122297,Alison,,Unincorporated Areas,37.12348,-122.12436,Entire home/apt,99,1,18,2020-03-15,2.51,1,0
20802290,Chez James Joyce,11670191,Joyce,,Unincorporated Areas,37.11903,-122.12162,Private room,55,2,11,2019-10-27,0.84,1,0
20828324,Cozy Studio Beach Bungalow,6326375,Laura,,City of Santa Cruz,36.96417,-121.99845,Entire home/apt,100,1,0,,,1,0
20845192,Spend August 2018 in Paradise!,126460983,Denise,,City of Capitola,36.97394,-121.94658,Entire home/apt,450,7,3,2018-03-28,0.10,1,0
20888022,Felton Forest Cottage Near Henry Cowell State Park,51591287,Rebecca & Tad,,Unincorporated Areas,37.04265,-122.07392,Entire home/apt,115,2,107,2020-03-08,3.39,1,0
20917445,Beautiful Hide-away in the Redwoods,146359429,Judy And Brian,,Unincorporated Areas,37.08145,-122.07694,Private room,78,1,99,2020-03-15,2.93,3,227
20920307,Peaceful Santa Cruz Retreat,107994,Tara,,City of Santa Cruz,36.9828,-122.01241,Entire home/apt,150,2,159,2020-03-01,5.43,1,148
20947074,"Entire home in Aptos, CA",7078579,Cayley,,Unincorporated Areas,36.96845,-121.87288,Entire home/apt,143,2,4,2018-07-29,0.12,2,0
20959328,Comfy room for rest and a world to explore!,146359429,Judy And Brian,,Unincorporated Areas,37.08145,-122.07694,Private room,65,1,168,2020-03-20,4.98,3,0
20992813,"10 Bedrooms, 10 Bathrooms in the Capitola Village",51440346,Capitola Hotel,,City of Capitola,36.97207,-121.95147,Private room,2500,1,4,2018-12-21,0.14,2,20
21020071,"Beach Cottage located blocks from the beach at Pleasure Point, Santa Cruz!",143960566,Bill,,City of Capitola,36.95695,-121.97377,Entire home/apt,222,2,19,2019-11-18,0.56,3,254
21042786,"Casa Tropicale' Cottage, upper Capitola Village",4266162,Janet & Marty,,City of Capitola,36.97752,-121.95634,Entire home/apt,140,14,2,2020-01-09,0.06,2,324
21056348,Relax in ocean view room,8539663,Sophie,,City of Santa Cruz,36.96308,-122.0517,Private room,80,1,12,2018-01-07,0.36,1,0
21092333,Bay View Bungalow,152057915,Shannon,,City of Santa Cruz,36.95179,-122.04594,Entire home/apt,165,2,69,2020-03-14,2.08,1,316
21165247,Santa Cruz Bungalow,152508751,Tim,,City of Santa Cruz,36.97589,-122.03405,Entire home/apt,200,2,74,2020-06-28,2.61,2,33
21189957,"Mediterranean Gem, Walk 2 Beach, Big TV, Fireplace",95291276,John,,Unincorporated Areas,36.97732,-121.92182,Entire home/apt,599,1,14,2019-04-11,0.43,3,114
21200666,Peaceful in Seacliff Beach,128159870,Dana,,Unincorporated Areas,36.97843,-121.91752,Entire home/apt,295,2,4,2020-02-23,0.17,1,43
21206682,Santa Cruz Get Away,104490167,Trish,,Unincorporated Areas,36.97671,-121.97922,Private room,99,1,118,2020-03-17,3.82,1,0
21216772,"Pleasure Point Retreat Steps to the Beach, 3 Bedroom (+ Convertible Bed), 3 Full Baths(Sleeps 6-8)",26960330,Justin,,City of Capitola,36.95608,-121.97622,Entire home/apt,340,2,24,2020-02-09,0.79,1,272
21261519,Redwood Riverfront Getaway,28313981,Steve,,Unincorporated Areas,37.13645,-122.12699,Entire home/apt,65,1,423,2020-06-17,13.08,1,247
21291767,Just Breathe @ the Pacific Looking Glass RDM Beach,33138626,Theresa,,Unincorporated Areas,36.96931,-121.90488,Entire home/apt,292,1,105,2020-03-22,3.45,1,329
21297945,"Surf Legendâ€™s home in Pleasure Point, Santa Cruz.",6135105,Andrea (And Frosty),,City of Capitola,36.95887,-121.96929,Entire home/apt,304,7,104,2020-03-22,3.17,1,205
21340108,Beach Front (S32),29898175,Brandelia,,Unincorporated Areas,36.87119,-121.82082,Entire home/apt,359,2,19,2020-01-20,0.58,35,302
21357140,UCSC_Ocean_Beach_Spa_PrivateBathroom,86256140,Sifang,,City of Santa Cruz,36.96001,-122.06154,Private room,66,3,71,2018-10-13,2.15,1,0
21358029,Cottage in the redwoods,549421,Paige,,City of Scotts Valley,37.06096,-121.99079,Entire home/apt,150,1,269,2020-03-16,8.19,1,0
21379947,"Ocean-View 4BR - Near Beach, Redwood State Park",154342553,Turnkey,,City of Capitola,36.95825,-121.96963,Entire home/apt,223,2,52,2020-04-03,1.72,16,210
21410398,Walk to downtown Santa Cruz & Boardwalk!!,854712,Vacation,,City of Santa Cruz,36.96756,-122.0326,Entire home/apt,180,31,6,2019-08-10,0.21,8,293
21564480,The East Room @ Redwood Croft,8186343,Sitah,,Unincorporated Areas,37.06126,-122.14744,Private room,215,2,11,2020-06-22,0.39,2,0
21668217,Coastal Mountain Access Deluxe,22071917,Greg,,Unincorporated Areas,36.98794,-121.94796,Entire home/apt,175,30,14,2020-02-22,0.46,2,41
21678599,Pleasure Point Pura Vida,85490183,David & Natalia,,City of Capitola,36.95921,-121.97484,Entire home/apt,425,14,16,2020-05-29,0.52,1,204
21679110,Santa Cruz Beach Getaway - 3Bed 2Bath,82966953,Dev H.,,Unincorporated Areas,36.96553,-121.98571,Entire home/apt,189,4,58,2020-06-05,1.89,4,148
21700593,Sea Forever~ Oceanfront Home in Pleasure Point!,15867956,Surf City,,City of Capitola,36.95655,-121.97859,Entire home/apt,550,2,14,2020-02-17,0.46,25,305
21755708,Romantic Hilltop Retreat Ocean View,6560497,Rebecca,,Unincorporated Areas,37.04645,-122.10683,Entire home/apt,500,1,37,2020-03-08,1.61,3,302
21783931,26Th Ave Family Beach House Steps to the Sand&Surf,993201,Cathy,,City of Capitola,36.95911,-121.97835,Entire home/apt,300,2,22,2020-02-28,0.81,1,309
21786549,Charming Beachside Cottage,6017247,Mary Jo,,City of Santa Cruz,36.95638,-122.03153,Entire home/apt,325,2,48,2020-03-08,1.88,3,0
21788128,Mountain Top Yurt in the Redwoods,46861078,Mary Hunter,,Unincorporated Areas,37.04281,-121.75562,Entire home/apt,99,2,370,2020-06-28,11.71,1,303
